Column1,Column2,Column3,Column4,Column5,Column6,Checked
84886454961,nach,Ich fliege nach München.,to (somewhere),I’m flying to Munich.,,
84886454962,nach,Es ist schon 5 nach 12.,after / past (time),It is already 5 past 12.,,
84886454963,nächst-,Sehen wir uns nächste Woche?,next,Are we seeing each other next week?,,
84886454964,"der Name, -n",Mein Name ist Thomas Schmidt.,name,My name is Thomas Schmidt.,,
84886454965,"der Name, -n","Mein Vorname ist Thomas, Schmidt ist der Familienname.",name,"My first name is Thomas, Schmidt is the surname.",,
84886454966,nehmen,Heute gibt es Hähnchen. Das nehme ich.,to have (food/drink),There is chicken today. I’ll have that.,,
84886454967,nehmen,Ich nehme den Bus.,to take,I take the bus.,,
84886454968,nein,"Fährst du auch nach München? / Nein, ich habe keine Zeit.",no,"Are you also travelling to Munich? / No, I don‘t have time.",,
84886454969,neu,Ich bin der neue Kollege.,new,I am the new colleague.,NB: male,
84886454970,neu,Wir haben eine neue Wohnung.,new,We have a new flat.,,
84886454971,nicht,Das stimmt nicht.,not,That’s not right.,,
84886454972,nicht,"Das ist doch schön, nicht?",no,"That’s really beautiful, no?",,
84886454973,nichts,Das macht nichts.,…,"It's okay, don't worry.",set phrase,
84886454974,nichts,Hier kaufe ich nichts. Der Laden gefällt mir nicht.,nothing,I won’t buy anything here. I don’t like the shop.,,
84886454975,nie,Er kommt nie pünktlich.,never,He is never on time.,,
84886454976,noch,Vielleicht kommt er noch.,still,Perhaps he will still come.,,
84886454977,noch,Wir warten noch fünf Minuten.,another,We will wait another five minutes.,,
84886454978,noch,Ich habe noch 20 Euro.,still,I still have 20 euros.,,
84886454979,normal,75 kg. Sein Gewicht ist normal.,normal,75 kg. His weight is normal.,,
84886454981,"die Nummer, -n",Welche Hausnummer haben Sie?,number,Which house number is yours?,,
84886454982,"die Nummer, -n",Können Sie mir Ihre Nummer geben?,number,Can you give me your number?,,
84886454983,nur,Ich möchte nur ein Glas Wasser.,only,I only want a glass of water.,,
84886454984,oben,Ich wohne oben.,upstairs,I live upstairs.,,
84886454985,das Obst,Im Sommer ist das Obst billig.,fruit,In summer fruit is cheap.,,
84886454986,oder,Wann können Sie kommen – heute oder morgen?,or,When can you come – today or tomorrow?,,
84886454987,öffnen,Ich öffne die Tür.,to open,I open the door.,,
84886454988,geöffnet,Der Laden ist samstags bis 16:00 Uhr geöffnet.,open,The shop is open until 4 pm on Saturdays.,,
84886454989,oft,Petra treffe ich oft.,often,I often meet Petra.,,
84886454990,ohne,Ohne Geld kann er nichts kaufen.,without,Without money he can’t buy anything.,,
84886454991,das Öl,Den Salat machen wir ohne Öl.,oil,We make the salad without oil.,,
84886454992,"die Oma, -s",Meine Oma ist schon tot.,grandmother,My grandmother is already dead.,,
84886454993,"der Opa, -s",Mein Opa heißt Hans.,grandfather,My grandfather is called Hans.,,
84886454994,die Ordnung,Das ist in Ordnung.,…,That is in order/acceptable/fine.,,
84886454995,"der Ort, -e",Der Ort liegt am Meer.,location / place,That place is by the sea.,,
84886454996,das Papier,Hier sind Papier und Bleistift.,paper,Here is a pencil and paper.,,
84886454997,die Papiere (pl.),Haben Sie Ihre Papiere dabei?,papers,Do you have your papers with you?,,
84886454998,"der Partner, -/",Er is mein Partner.,(male) partner,He is my partner.,,
84886454999,"die Partnerin, -nen",Sie ist meine Partnerin.,(female) partner,She is my partner.,,
84886455000,die Party,Heute Abend machen wir eine Party.,party,This evening we are having a party.,,
84886455001,"der Pass, -ä, e",Im Hotel brauchst du deinen Pass.,passport,In the hotel you need your passport.,,
84886455002,"die Pause, -n",Von 12:00 bis 12:30 Uhr haben wir Mittagspause.,break,From 12 until 12:30 pm we have a lunch break.,,
84886455003,"der Plan, -ä, e",Ich kaufe mir einen Stadtplan.,map / plan,I will buy myself a map of the town.,,
84886455004,"der Platz, -ä, e","Tut mir leid, der Platz ist besetzt.",seat,"I’m sorry, this seat is taken.",,
84886455005,"der Platz, -ä, e",Bitte nehmen Sie Platz!,seat,Please take a seat!,,
84886455006,"der Platz, -ä, e",Ich wohne neben dem Platz.,square,I live next to the square.,,
84886455007,die Polizei,Holen Sie die Polizei!,police,Fetch the police!,,
84886455008,die Pommes frites (pl.),Die Kinder essen Hähnchen mit Pommes frites.,chips,The children are eating chicken and chips.,,
84886455009,die Post,"Wo ist die Post, bitte?",post office,"Where is the post office, please?",,
84886455010,die Post,Ist Post da?,post / mail,Is there post?,,
84886455011,die Postleitzahl,Wie ist Ihre Postleitzahl?,postcode,What is your postcode?,,
84886455012,das Praktikum,Ich mache ein Praktikum bei Siemens.,internship,I am doing an internship at Siemens.,,
84886455013,die Praxis,Die Praxis ist ab acht Uhr geöffnet.,practice,The practice is open from 8 am.,,
84886455014,"der Preis, -e",Die Preise sind hoch.,price,The prices are high.,,
84886455015,"das Problem, -e",Mein Problem ist die Sprache.,problem,My problem is the language.,,
84886455016,"der Prospekt, -e",Bitte schicken Sie mir einen Prospekt von Ihrem Hotel.,brochure,Please send me a brochure for your hotel.,,
84886455017,die Prüfung,Die Prüfung ist am Montag um 8:00 Uhr.,examination,The exam is on Monday at 8 am.,,
84886455018,pünktlich,Der Bus fährt pünktlich um acht Uhr.,sharp,The bus leaves at 8 am sharp.,,
84886455019,pünktlich,Herr Müller ist immer pünktlich.,punctual,Mr Müller is always punctual.,,
84886455020,Rad fahren,Das Kind kann schon Rad fahren.,to cycle,The child can already ride a bike.,,
84886455021,rauchen,Ich rauche nicht.,to smoke,I don’t smoke.,,
84886455022,"der Raum, -ä, e",Der Unterricht ist in Raum 332.,room,The class is in room 332.,,
84886455023,"die Rechnung, -en","Die Rechnung, bitte.",bill,"The bill, please.",,
84886455024,rechts,Die Schillerstraße ist hier rechts.,right,Schillerstraße is on the right here.,,
84886455025,regnen,Heute regnet es.,to rain,Today it’s raining.,,
84886455026,der Regen,Bei diesem Regen gehe ich nicht raus.,rain,I’m not going out in this rain.,,
84886455027,der Reis,Ich esse gern Reis.,rice,I like eating rice.,,
84886455028,reisen,Ich reise gern.,to travel,I like to travel.,,
84886455029,die Reise,Wir machen eine Reise nach Österreich.,journey / trip,We are going on a trip to Austria.,,
84886455030,"das Reisebüro, -s",Mein Mann arbeitet im Reisebüro.,travel agency,My husband works at a travel agency.,,
84886455031,der Reiseführer,Ich kaufe mir einen Reiseführer von Berlin.,travel guide,I will buy myself a travel guide for Berlin.,,
84886455032,der Reiseführer,Unser Reiseführer heißt Peter.,tour guide,Our tour guide is called Peter.,,
84886455033,reparieren,Er hat das Fahrrad repariert.,to repair,He repaired the bicycle.,,
84886455034,die Reparatur,Die Reparatur ist sehr teuer.,repair,The repair is very expensive.,,
84886455035,"das Restaurant, -s",Wir essen heute in einem Restaurant.,restaurant,We are eating at a restaurant today.,,
84886455036,die Rezeption,Fragen Sie bitte im Hotel an der Rezeption.,reception,Please ask at the hotel reception.,,
84886455037,richtig,Habe ich das richtig verstanden?,correct,Have I understood that correctly?,,
84886455038,richtig,Das ist richtig.,right / correct,That's right.,,
84886455039,riechen,Dieser Wein riecht gut.,to smell,This wine smells good.,,
84886455040,ruhig,Ich möchte ein ruhiges Zimmer.,quiet,I would like a quiet room.,,
84886455041,der Saft,Möchtest du einen Apfelsaft?,juice,Would you like an apple juice?,,
84886455042,sagen,"Sag mal, wie geht es dir denn?",to say / tell,"Tell me, how’s it going?",,
84886455043,der Salat,Wie schmeckt dir der Salat?,salad,How does the salad taste?,,
84886455044,das Salz,"Entschuldigung, kann ich bitte das Salz haben?",salt,"Excuse me, can I have the salt please?",,
84886455045,"Satz, -ä, e",Dieser Satz ist sehr einfach.,sentence,This sentence is very simple.,,
84886455046,die S-Bahn,Ich nehme lieber die S-Bahn.,commuter train,I prefer to take the commuter train.,,
84886455047,der Schalter,Gehen Sie bitte zum Schalter drei!,counter,Please go to counter 3!,,
84886455048,scheinen,Die Sonne scheint.,to shine,The sun is shining.,,
84886455049,schicken,Bitte schicken Sie mir eine E-Mail.,to send,Please send me an email.,,
84886455050,"das Schild, -er",Haben Sie nicht das Schild gesehen?,sign,Did you not see the sign?,,
84886455051,"der Schinken, –",Ich möchte gern ein Schinkenbrot.,ham,I would like a ham roll.,,
84886455052,schlafen,Ich schlafe meistens acht Stunden.,to sleep,I usually sleep for eight hours.,,
84886455053,schlecht,Mir ist schlecht!,sick,I am sick.,NB: ill,
84886455054,schlecht,Sie sehen schlecht aus.,bad,You look bad.,,
84886455055,schlecht,Wir haben schlechtes Wetter.,bad,We have bad weather.,,
84886455056,schließen,"Bitte, schließen Sie die Tür.",to close,Please close the door.,,
84886455057,geschlossen,Die Bank hat am Samstag geschlossen.,closed,The bank is closed on Saturday.,,
84886455058,der Schluss,Ich muss jetzt Schluss machen.,…,I need to finish/wrap up now.,,
84886455059,der Schluss,Zum Schluss gibt er uns allen die Hand.,end,"At the end, he shakes everyone’s hand.",,
84886455060,"der Schlüssel, –",Ich gebe Ihnen noch den Zimmerschlüssel.,key,I’ll give you the room key as well.,,
84886455061,schmecken,Schmeckt das gut?,to taste,Does that taste good?,,
84886455062,schnell,Er fährt schnell.,quick / fast,He drives fast.,,
84886455063,schon,Ist das Essen schon fertig?,already,Is the food done already?,,
84886455064,schön,Schönen Urlaub!,lovely,Have a lovely holiday!,,
84886455065,schön,Das ist sehr schön.,beautiful,That is very beautiful.,,
84886455066,"der Schrank, -ä, e",Die Gläser stehen im Schrank.,cupboard,The glasses are in the cupboard.,,
84886455067,schreiben,Er schreibt jeden Tag fünfzig E-Mails.,to write,He writes fifty emails a day.,,
84886455068,"der Schuh, -e",Zieh die Schuhe aus!,shoe,Take your shoes off!,,
84886455069,die Schule,Meine Tochter geht schon in die Schule.,school,My daughter is already going to school.,,
84886455070,die Schule,Die Schule ist gleich hier um die Ecke.,school,The school is right around the corner.,,
84886455071,"der Schüler, –",In meinem Kurs sind acht Schülerinnen und fünf Schüler.,pupil,In my course there are 7 female pupils and 5 male pupils.,,
84886455072,schwer,Ist Ihr Gepäck sehr schwer?,heavy,Is your luggage very heavy?,,
84886455073,schwer,Das ist eine schwere Arbeit.,difficult,That is a very difficult job.,,
84886455074,"die Schwester, -n",Meine Schwester kommt am Dienstag.,sister,My sister is coming on Tuesday.,,
84886455075,schwimmen,Ich schwimme jeden Tag einen Kilometer.,to swim,I swim a kilometre every day.,,
84886455076,das Schwimmbad,Kommst du mit ins Schwimmbad?,swimming pool,Are you coming to the swimming pool with us?,,
84886455077,der See,"Komm, wir fahren zum Starnberger See.",lake,"Come, we’re going to Starnberg lake.",,
84886455078,sehen,Ich kann dich nicht sehen.,to see,I can’t see you.,,
84886455079,sehen,Ich habe diesen Jungen schon einmal gesehen.,to see,I have seen this boy before.,,
84886455080,"die Sehenswürdigkeit, -en",Welche Sehenswürdigkeiten gibt es in Frankfurt?,sights/attractions,Which sights are there to see in Frankfurt?,,
84886455081,sehr,Danke sehr!,very,Thank you very much!,,
84886455082,sehr,Das ist sehr schwer.,very,That is very heavy.,alt: That is very difficult.,
84886455083,sein,Herr Müller ist in seinem Zimmer.,his,Mr Müller is in his room.,,
84886455084,sein,Mir ist kalt.,to be,I'm cold.,,
84886455085,sein,Ich bin dreiundzwanzig.,to be,I am twenty three.,,
84886455086,an sein,Das Licht ist noch an.,to be on,The light is still on.,,
84886455087,auf sein,Das Fenster ist noch auf.,to be open,The window is still open.,,
84886455088,weg sein,Herr Meier ist schon weg.,to be gone,Mr Meier is already gone.,,
84886455089,zu sein,Die Tür ist zu.,to be closed,The door is closed.,,
84886455090,seit,Ich wohne seit drei Jahren in Köln.,for (an amount of time),I have lived in Cologne for three years.,,
84886455091,selbstständig,Er ist selbstständig.,independent,He is independent.,,
84886455092,sich,Sie müssen sich erst anmelden.,yourself,You must register yourself first.,,
84886455093,sie,Wie heißt sie?,she,What is she called?,,
84886455094,Sie,"Wie heißen Sie, bitte?",you (polite),"What is your name, please?",,
84886455095,sitzen,Wo sitzen Sie?,to sit,Where are you sitting?,,
84886455096,so,Sie müssen das so machen!,like this,You must do it like this!,,
84886455097,so,Fahren Sie bitte nicht so schnell!,so,Please don’t drive so fast!,,
84886455098,so,Meine Frau ist so groß wie ich.,as,My wife is as tall as me.,,
84886455099,so,"So, das war's/wär's!",so,"So, that's it!",,
84886455100,das Sofa,Das Sofa ist neu.,sofa,The sofa is new.,,
84886455101,sofort,Bitte antworten Sie sofort.,immediately,Please answer immediately.,,
84886455102,"der Sohn, -ö, e","Das ist Hans, mein Sohn.",son,"That is Hans, my son.",,
84886455103,sollen,Soll ich kommen?,should,Should I come?,,
84886455104,sollen,Was soll ich mitbringen?,should,What should I bring with me?,,
84886455105,die Sonne,Die Sonne scheint.,sun,The sun is shining.,,
84886455106,spät,"Es ist schon spät, ich muss gehen.",late,"It is already late, I need to go.",,
84886455107,später,Das können wir später machen.,later,We can do that later.,,
84886455108,die Speisekarte,"Bringen Sie mir die Speisekarte, bitte.",menu,"Bring me the menu, please.",,
84886455109,spielen,Die Kinder spielen draußen.,to play,The children are playing outside.,,
84886455110,spielen,Spielen Sie Karten?,to play,Do you play cards?,,
84886455111,der Sport,Ich mache viel Sport.,sport,I do a lot of sport.,,
84886455112,"die Sprache, -n",Welche Sprachen sprichst du?,language,Which languages do you speak?,,
84886455113,sprechen,Kann ich (mit) Herrn Klein sprechen?,to speak,Can I speak with Mr Klein?,,
84886455114,"die Stadt, -ä, e",Heidelberg ist eine alte Stadt.,town / city,Heidelberg is an old town.,,
84886455115,stehen,"Ich glaube es nicht, aber es steht in der Zeitung.",to be (written),"I don’t believe it, but it says so in the paper.",,
84886455116,stehen,Der Bus steht schon an der Haltestelle.,to be (located),The bus is already at the stop.,,
84886455117,"die Stelle, -n",Ich habe eine neue Stelle.,job / position,I have a new job.,,
84886455118,stellen,Stell die Tasche rechts in die Ecke!,to put,Put your bag on the right in the corner.,,
84886455119,der Stock,Unsere Wohnung liegt im ersten Stock.,floor (of a building),Our flat is on the first floor.,,
84886455120,"die Straße, -n",In welcher Straße wohnen Sie?,street,Which street do you live on?,,
84886455121,die Straßenbahn,Wo fährt die Straßenbahn ab?,tram,From where does the tram depart?,,
84886455122,studieren,Ich studiere in Mainz.,to study,I study in Mainz.,,
84886455123,das Studium,Das Studium beginnt im Oktober.,degree course,The degree course begins in October.,,
84886455124,"der Student, -en",Ich bin Studentin.,student,I am a student.,NB: female,
84886455125,"die Stunde, -n",Ich bin in einer Stunde zurück.,hour,I will be back in an hour.,,
84886455126,suchen,Suchst du etwas?,to look / search for,Are you looking for something?,,
84886455127,tanzen,Tanzen Sie gern?,to dance,Do you like to dance?,,
84886455128,"die Tasche, -n",Ich habe die Schlüssel in der Tasche.,bag,I have the key in the bag.,,
84886455129,"das Taxi, -s",Es gibt heute keinen Bus mehr. Er fährt mit dem Taxi.,taxi,There are no more buses today. He is travelling by taxi.,,
84886455130,der Tee,Ich trinke morgens immer Tee.,tea,I always drink tea in the morning.,,
84886455131,"der Teil, -e",Lies bitte auch den zweiten Teil.,part,Please also read the second part.,,
84886455132,telefonieren,Darf ich mal telefonieren?,to telephone,May I make a phone call?,,
84886455133,das Telefon,Haben Sie ein Telefon?,telephone,Do you have a telephone?,,
84886455134,"der Termin, -e",Am besten machen wir sofort einen Termin.,appointment,It's best to make an appointment immediately.,,
84886455135,der Test,Der Test war einfach.,test,The test was simple.,,
84886455136,teuer,Das ist mir zu teuer.,expensive,That is too expensive for me.,,
84886455137,"der Text, -e",Lesen Sie bitte diesen Text.,text,Please read this text.,,
84886455138,das Thema,Wir sprechen heute über das Thema „Essen und Trinken“.,topic,Today we are talking about the topic “Food and Drink”.,,
84886455139,"das Ticket, -s",Wie viel kostet das Ticket?,ticket,How much does the ticket cost?,,
84886455140,"der Tisch, -e",Die Fotos liegen auf dem Tisch.,table,The photos are on the table.,,
84886455141,"die Tochter, -ö",Das ist meine Tochter Katharina.,daughter,That is my daughter Katharina.,,
84886455142,"die Toilette, -en","Wo ist die Toilette, bitte?",toilet,"Where is the toilet, please?",,
84886455143,"die Tomate, -n",Die Tomate ist noch grün.,tomato,The tomato is still green.,,
84886455144,tot,Sein Vater ist schon lange tot.,dead,His father has been dead for a long time.,,
84886455145,(sich) treffen,Ich treffe in der Stadt einen Kollegen.,to meet,I am meeting a colleague in town.,NB: male,
84886455146,(sich) treffen,Wir treffen uns immer freitags.,to meet,We always meet on Fridays.,,
84886455147,"die Treppe, -n",Die Toilette? Die Treppe hoch und dann links.,stairs,The toilet? Up the stairs and then left.,,
84886455148,trinken,Möchtest du etwas trinken?,to drink,Would you like something to drink?,,
84886455149,tschüss,Junge Leute sagen meistens „tschüss!“ und nicht „auf Wiedersehen“.,...,Young people mostly say “tschüss!” and not “auf Wiedersehen”.,,
84886455150,tun,Ich habe noch etwas zu tun.,to do,I still have something to do.,,
84886455151,tun,Was tut Ihr Mann?,to do,What does your husband do?,NB: very broad question,
84886455152,über,Gehen Sie hier über die Straße.,across,Go across the street here.,,
84886455153,über,Er wohnt im zweiten Stock über Familie Meier.,above,He lives on the second floor above the Meier family.,,
84886455154,über,Sind Sie über 18?,over,Are you over 18?,,
84886455155,übernachten,Du kannst bei mir übernachten.,to stay overnight,You can stay at mine overnight.,,
84886455156,überweisen,Sie können das Geld auch überweisen.,to transfer,You can also transfer the money.,,
84886455157,die Uhr,Es ist vier Uhr.,o'clock / am / pm,It is four o’clock.,,
84886455158,um,Er kommt um sieben Uhr.,at,He is coming at seven o’clock.,,
84886455159,um,Da kommt er gerade um die Ecke.,around,Here he comes around the corner now.,,
84886455160,umziehen,Nächsten Monat ziehen wir um.,to move (residence),Next month we are moving.,,
84886455161,und,Peter und Helmut sind meine Söhne.,and,Peter and Helmut are my sons.,,
84886455162,unser-,Das ist unsere Lehrerin.,our,That is our teacher.,NB: female,
84886455163,unten,Er wohnt ganz unten im Haus.,at the bottom,He lives right at the bottom of the house.,,
84886455164,unter,Unter uns wohnt eine Familie mit drei Kindern.,below,Below us lives a family with three children.,,
84886455165,der Unterricht,Wir haben Unterricht von 8:00 bis 12:00 Uhr.,class,We have classes from 8 am until 12 pm.,,
84886455166,unterschreiben,Wo muss ich unterschreiben?,to sign,Where do I need to sign?,,
84886455167,die Unterschrift,Hier fehlt noch Ihre Unterschrift.,signature,Your signature is missing here.,,
84886455168,der Urlaub,Ich nehme im September Urlaub.,holiday,I’m taking holiday in September.,,
84886455169,"der Vater, -ä",Mein Vater ist Arbeiter.,father,My father is a worker.,,
84886455170,verboten,Hier ist Rauchen verboten.,forbidden,Smoking is forbidden here.,,
84886455171,verdienen,Ich verdiene 1.500 Euro im Monat.,to earn,"I earn 1,500 euros per month.",,
84886455172,der Verein,Es gibt einen neuen Sportverein in der Stadt.,club,There is a new sports club in the town.,,
84886455173,verheiratet,Ich bin verheiratet und habe drei Kinder.,married,I am married and have three children.,,
84886455174,verkaufen,Er verkauft sein altes Auto.,to sell,He is selling his old car.,,
84886455175,"der Verkäufer, –",Meine Mutter ist Verkäuferin im Kaufhaus.,salesperson,My mother is a saleswoman in a department store.,,
84886455176,vermieten,Die Wohnung ist schon vermietet.,to rent out,The flat is already rented out.,,
84886455177,der Vermieter,Unser Vermieter heißt Huber. Er wohnt auch hier.,landlord,"Out landlord is called Huber. He lives here, too.",,
84886455178,verstehen,Können Sie mich verstehen?,to understand,Can you understand me?,,
84886455179,"der Verwandte, -n",Peter besucht seine Verwandten in Polen.,relative,Peter visits his relatives in Poland.,,
84886455180,viel,Hier regnet es viel.,a lot,It rains a lot here.,,
84886455181,vielleicht,Ich komme vielleicht mit dem Bus.,perhaps / may(be),I may come by bus.,,
84886455182,von,Das Auto von Felix ist kaputt.,"of (possessive “s"")",Felix’s car is broken.,,
84886455183,von,Er kommt gerade von Köln/von zu Hause.,from,He’s coming from Cologne/home now.,,
84886455184,vor,Der Termin war vor einer Stunde.,ago,The appointment was an hour ago.,,
84886455185,vor,Das Auto steht vor der Tür.,in front of,The car is in front of the door.,,
84886455186,"der Vorname, -n","Ich heiße Müller, mein Vorname ist Eva.",first name,"I’m called Müller, my first name is Eva.",,
84886455187,die Vorsicht,Vorsicht! Da kommt ein Auto.,…,Careful! There’s a car coming.,,
84886455188,die Vorsicht,Er arbeitet mit Vorsicht.,attention,He works with caution.,,
84886455189,(sich) vorstellen,Wir wollen uns kennenlernen. Können Sie sich bitte vorstellen?,to introduce,We would like to get to know each other. Can you introduce yourself?,,
84886455190,die Vorwahl,Wie ist die Vorwahl von München?,area code,What is the area code for Munich?,,
84886455191,wandern,Wir wandern um den Chiemsee.,to hike,We are hiking around the Chiem lake.,,
84886455192,wann,Wann bist du fertig?,when,When will you be finished?,,
84886455193,wann,Wann kann ich Sie anrufen?,when,When can I call you?,,
84886455194,wann,Wann sind Sie geboren?,when,When were you born?,,
84886455195,warten,Können Sie ein paar Minuten warten?,to wait,Can you wait a few minutes?,,
84886455196,warten,Auf wen warten Sie?,to wait,Who are you waiting for?,,
84886455197,warum,Warum kommt er nicht?,why,Why isn’t he coming?,,
84886455198,was,Was ist das?,what,What is that?,,
84886455199,was,Was möchten Sie?,what,What would you like?,,
84886455200,was für ein,Was für eine Farbe möchten Sie?,what kind of,What colour would you like?,,
84886455201,(sich) waschen,Wo kann ich mir die Hände waschen?,to wash,Where can I wash my hands?,,
84886455202,(sich) waschen,Ich muss morgen waschen.,to wash,I need to do laundry tomorrow.,,
84886455203,das Wasser,"Ein Glas Wasser, bitte.",water,"A glass of water, please.",,
84886455204,weh tun,Ich muss zum Arzt. Mein Bein tut weh.,to hurt,I need to go to the doctor. My leg hurts.,,
84886455205,weiblich,Kreuzen Sie bitte an: „weiblich“ oder „männlich“.,female,Please tick “female” or “male”.,,
84886455206,der Wein,"Nein danke, ich möchte keinen Wein.",wine,"No thank you, I don’t want any wine.",,
84886455207,weit,Zum Bahnhof ist es nicht weit.,far,It is not far to the station.,,
84886455208,weiter,Der Bus fährt nicht weiter.,further,The bus doesn’t go any further.,,
84886455209,welch-,Welches Buch möchtest du?,which,Which book would you like?,,
84886455210,die Welt,Es gibt viele Probleme auf der Welt.,world,There are many problems in the world.,,
84886455211,wenig,Ich habe leider nur wenig verstanden.,little / not very much,Unfortunately I didn't understand very much.,,
84886455212,wenig,Er verdient wenig.,little,He earns little.,,
84886455213,wer,Wer ist das?,who,Who is that?,,
84886455214,werden,Mein Sohn will Arzt werden.,to become,My son wants to become a doctor.,,
84886455215,das Wetter,Wir hatten schlechtes Wetter.,weather,We had bad weather.,,
84886455216,wichtig,Dieses Formular ist sehr wichtig.,important,This form is very important.,,
84886455217,wie,Wie heißt du?,what,What are you called?,,
84886455218,wie,Er schreibt wie ein Kind.,like,He writes like a child.,,
84886455219,wie,Meine Frau ist so groß wie ich.,as,My wife is as tall as me.,,
84886455220,wie,Wie soll ich das machen?,how,How should I do that?,,
84886455221,wie,Wie groß ist die Wohnung?,how,How big is the flat?,,
84886455222,wie,Wie bitte?,…,Pardon?,,
84886455223,wie,Wie lange bist du schon hier?,how,How long have you been here already?,,
84886455224,wiederholen,Können Sie das bitte wiederholen?,to repeat,"Can you repeat that, please?",,
84886455225,das Wiederhören,Wir müssen jetzt Schluss machen. Also auf Wiederhören!,…,"We have to wrap up. Right, goodbye!",NB: used on the telephone,
84886455226,das Wiedersehen,Auf Wiedersehen!,…,Goodbye!,lit: “until we see each other again”,
84886455227,wie viel,Wie viel Milch nehmen Sie?,how much,How much milk do you take?,,
84886455228,willkommen,Herzlich willkommen!,…,Welcome!,,
84886455229,der Wind,Der Wind kommt aus Osten.,wind,The wind is coming from the east.,,
84886455230,wir,Wir lernen Deutsch.,we,We are learning German.,,
84886455231,wissen,"Weißt du, wie er heißt?",to know,Do you now what he is called?,,
84886455232,wo,Wo waren Sie im Urlaub?,where,Where were you on holiday?,,
84886455233,wo,Wo ist die Post?,where,Where is the post office?,,
84886455234,wo,Wo sind Sie geboren?,where,Where were you born?,,
84886455235,woher,Woher kommen Sie?,from where,Where do you come from?,,
84886455236,wohin,Wohin fährt dieser Bus?,to where,Where does this bus go?,,
84886455237,wohin,Wohin wollen Sie am Wochenende?,to where,Where do you want to go this weekend?,,
84886455238,wohnen,Ich wohne in München.,to live,I live in Munich.,,
