Column1,Column2,Column3,Column4,Column5,Column6,Checked
84886454710,fremd,"Das weiß ich nicht, ich bin fremd hier.",foreign,"I don’t know, I’m not from here.",,
84886454711,(sich) freuen,Ich freue mich auf den Urlaub.,to look forward,I’m looking forward to the holiday.,,
84886454712,"der Freund, -e",Das ist ein Freund von mir.,friend,That is a friend of mine.,,
84886454713,die Freundin,Das ist meine Freundin.,friend / girlfriend,That is my friend/girlfriend.,context differentiates between friend/girlfriend,
84886454714,früher,Früher waren wir oft zusammen im Kino.,earlier / in the past,In the past we often went to the cinema together.,,
84886454715,frühstücken,Am Sonntag frühstücke ich gern im Bett.,to have breakfast,On Sunday I like to have breakfast in bed.,,
84886454716,das Frühstück,Möchtest du ein Ei zum Frühstück?,breakfast,Would you like an egg for breakfast?,,
84886454717,die Führung,Die Führung durch das Haus beginnt in 3 Minuten.,tour,The tour of the house begins in 3 minutes.,,
84886454718,für,Das ist für Sie.,for,That's for you.,,
84886454719,für,Das ist der Schlüssel für die Haustür.,for,That's the key for the front door.,,
84886454720,für,Das ist das Brot für morgen.,for,That's the bread for tomorrow.,,
84886454721,"der Fuß, -ü, e",Der linke Fuß tut mir weh.,foot,My left foot hurts.,,
84886454722,der Fußball,Spielt ihr gerne Fußball?,football,Do you like playing football?,,
84886454723,der Garten,Wir haben leider keinen Garten.,garden,Unfortunately we don't have a garden.,,
84886454724,"der Gast, -ä, e",Am Wochenende haben wir mehrere Gäste.,guest,At the weekend we have several guests.,,
84886454725,geben,Kannst du mir bitte deinen Kugelschreiber geben?,to give,"Can you give me your pen, please?",,
84886454726,es gibt,Es gibt keine Karten mehr.,there is/are,There are no more tickets.,,
84886454727,geboren,Ich bin in Zagreb geboren.,born,I was born in Zagreb.,,
84886454728,das Geburtsjahr,"Das Geburtsjahr Ihres Sohnes, bitte?",birth year,"Your son's year of birth, please?",,
84886454729,der Geburtsort,Bitte schreiben Sie Ihren Geburtsort auf das Formular.,birthplace,Please write your birthplace on the form.,,
84886454730,der Geburtstag,Herzlichen Glückwunsch zum Geburtstag!,birthday,Best wishes on your birthday!,"or simply ""Happy birthday!""",
84886454731,gefallen,Das gefällt mir.,to like,I like that.,,
84886454732,gegen,Fahr nicht gegen den Baum!,into,Don’t drive into the tree!,,
84886454733,gegen,Ich bin gegen diese Lösung.,against,I am against this solution.,,
84886454734,gegen,Wer spielt gegen wen?,against,Who is playing against whom?,,
84886454735,gehen,"Ich weiß nicht, wie das geht.",to work/function,I don’t know how it works./I don't know how to do that.,,
84886454736,gehen,Wie geht's?,to go,How is it going?,,
84886454737,gehen,Jetzt muss ich (aber) leider gehen.,to go,Unfortunately I need to go now.,,
84886454738,gehen,Ich muss zum Arzt gehen.,to go,I need to go to the doctor.,,
84886454739,gehen,Das geht nicht!,to be okay,That’s not okay!,,
84886454740,gehören,Wem gehört das?,to belong,To whom does that belong?,,
84886454741,das Geld,Hast du noch Geld?,money,Do you still have money?,,
84886454742,das Gemüse,Gemüse brauchen wir auch noch.,vegetables,We also need vegetables.,,
84886454743,das Gepäck,Wollen Sie Ihr Gepäck mitnehmen?,luggage,Do you want to take your luggage with you?,,
84886454744,gerade,Da kommt er ja gerade.,now,There he comes now.,,
84886454745,geradeaus,Gehen Sie immer geradeaus!,straight on,Keep going straight on!,,
84886454746,gern(e),Ich gehe gerne einkaufen.,…,I like to go shopping.,etwas gern tun = to like doing something,
84886454747,"das Geschäft, -e",Die Geschäfte schließen um 18.30 Uhr.,shop,The shops close at 6:30 pm.,,
84886454748,"das Geschenk, -e",Danke für das schöne Geschenk.,present,Thank you for the beautiful present.,,
84886454749,die Geschwister (pl.),Ich habe leider keine Geschwister.,sibling,Unfortunately I have no siblings.,,
84886454750,"das Gespräch, -e",Das Gespräch mit Frau Kunz ist um 14 Uhr.,conversation/talk/call,The conversation with Ms Kunz is at 2 pm.,,
84886454751,gestern,Gestern war ich krank.,yesterday,Yesterday I was ill.,,
84886454752,gestorben,Meine Frau ist gestern gestorben.,died,My wife died yesterday.,,
84886454753,"das Getränk, -e",Mein Lieblingsgetränk ist Tomatensaft.,drink,My favourite drink is tomato juice.,,
84886454754,das Gewicht,Bei „Gewicht“ schreibst du: 62 Kilo.,weight,"For “weight”, write 62 kg.",,
84886454755,gewinnen,Wer gewinnt das Spiel?,to win,Who is winning the game?,,
84886454756,"das Glas, -ä, er",Bitte noch ein Glas Wein!,glass,"Another glass of wine, please!",,
84886454757,"das Glas, -ä, er",Wir brauchen noch drei Gläser.,glasses,We need three more glasses.,,
84886454758,glauben,"Sie können mir glauben, es ist so.",to believe,"You can believe me, it’s true.",,
84886454759,glauben,"Ich glaube, er kommt gleich.",to think,I think he’ll be here in a moment.,,
84886454760,gleich,Das ist mir gleich.,same,It’s all the same to me.,,
84886454761,gleich,Das ist der gleiche Preis.,same,That is the same price.,,
84886454762,gleich,Ich komme gleich.,now,I’ll be right there.,,
84886454763,"das Gleis, -e",Der ICE nach Berlin hält heute an Gleis 12.,platform,The ICE to Berlin is stopping on platform 12 today.,,
84886454764,das Glück,Viel Glück!,luck,Good luck!,,
84886454765,glücklich,Meine Kinder sind glücklich verheiratet.,happily,My children are happily married.,,
84886454766,der Glückwunsch,Herzlichen Glückwunsch zum Geburtstag.,congratulations,Best wishes on your birthday!,,
84886454767,Grad (Celsius),Heute haben wir dreißig Grad.,degrees,Today it is thirty degrees.,,
84886454768,gratulieren,Ich gratuliere dir!,to congratulate,I congratulate you!,,
84886454769,grillen,Heute grillen wir im Garten.,to (have a) barbecue,Today we are having a barbecue in the garden.,,
84886454770,groß,Mein Bruder und ich sind gleich groß.,tall,My brother and I are the same height.,,
84886454771,groß,Frankfurt ist eine große Stadt.,large,Frankfurt is a large town.,,
84886454772,die Größe,Haben Sie das auch in Größe 40?,size,Do you also have that in size 40?,,
84886454773,die Großeltern (pl.),Meine Großeltern leben in Japan.,grandparents,My grandparents live in Japan.,,
84886454774,die Großmutter,Meine Großmutter heißt Eva.,grandmother,My grandmother is called Eva.,,
84886454775,der Großvater,Mein Großvater ist schon 80.,grandfather,My grandfather is already 80.,,
84886454776,"die Gruppe, -n",Die erste Gruppe beginnt um 16 Uhr.,group,The first group begins at 4 pm.,,
84886454777,"der Gruß, -ü, e",Viele Grüße an Ihre Frau.,regards,Give my regards to your wife.,,
84886454778,"der Gruß, -ü, e",Mit freundlichen Grüßen,regards,Kind regards.,,
84886454779,gültig,Der Pass ist nicht mehr gültig.,valid,The passport is no longer valid.,,
84886454780,günstig,Dort gibt es günstige Angebote.,cheap,There are cheap offers there.,,
84886454781,gut,Das finde ich gut.,good,I think that’s good.,,
84886454782,gut,Ich komme um 13 Uhr. / Gut!,good,I will arrive at 1 pm. / Good!,,
84886454783,gut,Guten Morgen!,good,Good morning!,,
84886454784,gut,Ein gutes neues Jahr!,…,Happy new year!,,
84886454785,gut,Guten Appetit!,…,Bon appetit!,,
84886454786,"das Haar, -e",Sie hat lange Haare.,hair,She has long hair.,,
84886454787,haben,Ich habe ein neues Auto.,to have,I have a new car.,,
84886454788,"das Hähnchen, -",Ein Hähnchen mit Pommes bitte!,chicken,"Chicken with chips, please!",,
84886454789,die Halbpension,Möchten Sie Vollpension oder Halbpension?,board (dining),Would you like full or half-board?,,
84886454790,die Halle,Wir treffen uns in Halle B.,hall,We will meet in hall B.,,
84886454791,hallo,Hallo Inge! Wie geht’s?,hello,Hello Inge! How’s it going?,,
84886454792,halten,Dieser Zug hält nicht in Rüdesheim.,to stop,This train does not stop in Rüdesheim.,,
84886454793,die Haltestelle,An der nächsten Haltestelle müssen Sie aussteigen.,(public transport) stop,At the next stop you must alight.,,
84886454794,"die Hand, -ä, e",Er gibt mir die Hand.,hand,He gives me his hand.,,
84886454795,"das Handy, -s",In der Schule bitte die Handys ausmachen!,mobile telephone,Please turn off your mobile phones in school!,,
84886454796,"das Haus, -ä, er",In welchem Haus wohnst du?,house / building,Which house do you live in?,,
84886454797,"das Haus, -ä, er",Ich gehe jetzt nach Hause.,home,I’m going home now.,,
84886454798,"das Haus, -ä, er",Paul ist nicht zu Hause.,home,Paul is not home.,,
84886454799,"die Hausaufgabe,-n",Kannst du mir bei den Hausaufgaben helfen?,homework,Can you help me with the homework?,,
84886454800,"die Hausfrau, -en/","Die Hausfrau wäscht, kocht und kauft ein.",housewife,"The housewife washes, cooks, and goes shopping.",,
84886454801,der Hausmann,"Der Hausmann wäscht, kocht und kauft ein.",househusband,"The househusband washes, cooks, and goes shopping.",,
84886454802,die Heimat,Ich komme aus der Schweiz. Das ist meine Heimat.,home,I come from Switzerland. It’s my home.,,
84886454803,heiraten,Meine Schwester heiratet einen Japaner.,to marry,My sister is marrying a Japanese man.,,
84886454804,heißen,Ich heiße Charlotte Meier.,to be called,I’m called Charlotte Meier.,,
84886454805,heißen,Wie heißt das auf Deutsch?,to be called,What’s that called in German?,,
84886454806,helfen,"Können Sie mir helfen, bitte?",to help,"Can you help me, please?",,
84886454807,hell,Im Sommer ist es bis 21 Uhr hell.,light,In summer it is light until 9 pm.,,
84886454808,der Herd,In der neuen Küche fehlt noch der Herd.,stove,The stove is still missing from the new kitchen.,,
84886454809,"der Herr, -en","Guten Tag, Herr Sommer!",Mister,"Good day, Mr Sommer!",,
84886454810,herzlich,Herzlichen Glückwunsch!,…,Congratulations!,,
84886454811,heute,Heute ist ein schöner Tag.,today,Today is a beautiful day.,,
84886454812,hier,"Hier ist 06131-553221, Pamela Linke.",here,"This is 06131-553221, Pamela Linke.",,
84886454813,hier,Hier wohne ich.,here,I live here.,,
84886454814,die Hilfe,Hilfe! Bitte helfen Sie mir!,help,Help! Please help me!,,
84886454815,die Hilfe,Brauchen Sie meine Hilfe?,help,Do you need my help?,,
84886454816,hinten,Die Tür zum Aussteigen ist hinten.,at/in the back,The exit door is at the back.,,
84886454817,"das Hobby, -s",Meine Hobbys sind Wandern und Schwimmen.,hobby,My hobbies are hiking and swimming.,,
84886454818,hoch,Der Mount Everest ist 8.880 Meter hoch.,high,"Mount Everest is 8,880 metres high.",,
84886454819,die Hochzeit,Zur dieser Hochzeit kommen mehr als fünfzig Gäste.,marriage,More than fifty guests are coming to this wedding.,,
84886454820,holen,Ich hole zwei Flaschen Wasser aus der Küche.,to fetch,I’m fetching two bottles of water from the kitchen.,,
84886454821,hören,Hör mal! Was ist das?,to listen,Listen! What is that?,,
84886454822,hören,Ich habe das Lied schon mal gehört.,to hear,I have already heard that song.,,
84886454823,"das Hotel, -s",Im Urlaub sind wir in einem Hotel am Meer.,hotel,On holiday we are in a hotel by the sea.,,
84886454824,"der Hund, -e",Der Hund ist noch jung.,dog,The dog is still young.,,
84886454825,der Hunger,Ich habe Hunger! Wann ist das Essen fertig?,hunger,I’m hungry! When will the food be ready?,,
84886454826,ich,Ich heiße Veronika.,I,I’m called Veronika.,,
84886454827,ihm/ihr,Gib ihm/ihr bitte das Buch.,him/her,Please give the book to him/her.,,
84886454828,ihn,Ruf ihn bitte an.,him,"Call him, please.",,
84886454829,immer,Frau Bast kommt immer zu spät.,always,Ms Bast is always late.,,
84886454830,in,Ich wohne in Wiesbaden.,in,I live in Wiesbaden.,,
84886454831,in,Der Zug kommt in fünf Minuten.,in,The train comes in five minutes.,,
84886454832,in,Frau Rausch arbeitet in einem Geschäft.,in,Ms Rausch works in a shop.,,
84886454833,in,"Komm, wir gehen ins Kino.",to,"Come on, we’re going to the cinema.",,
84886454834,"die Information, -en","Wenn Sie Fragen haben, gehen Sie zur Information.",information point,"If you have questions, go to the information point.",,
84886454835,"die Information, -en",Wir haben hier wichtige Informationen für Sie.,information,We have important information for you.,,
84886454836,international,"Unser Deutschkurs ist international: Silvana kommt aus Italien, Conchi aus Spanien, Yin aus China ...",international,"Our German course is international: Silvana comes from Italy, Conchi from Spain, Yin from China, …",,
84886454837,das Internet,Das findest du im Internet.,internet,You will find that on the internet.,,
84886454838,ja,Sind Sie Herr Watanabe? / Ja.,yes,Are you Mr Watanabe? / Yes.,,
84886454839,"die Jacke, -n",Zieh dir eine Jacke an. Es ist kalt.,jacket,Put your jacket on. It’s cold.,,
84886454840,jed-,Blumen kannst du in jedem Bahnhof kaufen.,every,You can buy flowers at every station.,,
84886454841,jetzt,Jetzt machen wir eine Pause.,now,Now we will take a break.,,
84886454842,"der Job, -s",Jenny hat einen neuen Job bei der Post.,job,Jenny has a new job at the post office.,,
84886454843,"der Jugendliche, -n",Viele Jugendliche kaufen gern ein.,youth/young person,Many youths like shopping.,,
84886454844,jung,Claudia ist 21. / Was? Noch so jung?,young,Claudia is 21. / What? Still so young?,,
84886454845,"der Junge, -n",Ich habe zwei Kinder. Einen Jungen und ein Mädchen.,boy,I have two children. One boy and one girl.,,
84886454846,der Kaffee,Zum Frühstück trinke ich immer Kaffee.,coffee,For breakfast I always drink coffee.,,
84886454847,kaputt,Das Glas war teuer. Es geht sehr leicht kaputt.,…,The glass was expensive. It will break very easily.,kaputt gehen = to break,
84886454848,kaputt,Das Glas ist kaputt.,broken,The glass is broken.,,
84886454849,"die Karte, -n",Ich schreibe meinen Bekannten eine Karte aus dem Urlaub.,card,I’ll write my acquaintances a card from holiday.,,
84886454850,"die Karte, -n",Wollen wir Karten spielen?,card,Shall we play cards?,lit. “do we want to…”,
84886454851,"die Karte, -n","Ich möchte auch etwas essen. Bringen Sie mir die Karte, bitte.",menu,I also want to eat something. Please bring me the menu.,,
84886454852,"(Kredit)-Karte, -n",Kann ich auch mit Karte (be-) zahlen?,(credit) card,Can I also pay by card?,,
84886454853,"die Kartoffel, -n",Für Pommes frites braucht man Kartoffeln.,potato,For chips you need potatoes.,,
84886454854,die Kasse,Zahlen Sie bitte an der Kasse.,till,Please pay at the till.,,
84886454855,kaufen,Tim kauft sich ein neues Auto.,to buy,Tim buys himself a new car.,,
84886454856,kein,Es gibt keine Eintrittskarten mehr.,no/none,There are no more tickets.,,
84886454857,kennen,"Kennen Sie diese Frau? / Nein, leider nicht.",to know,"Do you know this woman? / No, unfortunately not.",,
84886454858,kennenlernen,Wir sind neu hier. Wir möchten Sie kennenlernen.,to get to know,We are new here. We would like to get to know you.,,
84886454859,"das Kind, -er",Wie viele Kinder haben Sie?,child,How many children do you have?,,
84886454860,der Kindergarten,Die kleine Laura geht schon in den Kindergarten.,kindergarten,Little Laura is already going to kindergarten.,,
84886454861,"das Kino, -s",Wir sehen heute Abend im Kino einen schönen Film.,cinema,We’re watching a lovely film this evening.,,
84886454862,der Kiosk,"Am Kiosk bekommen Sie Getränke, Zigaretten und Zeitungen.",kiosk,"At the kiosk you can get drinks, cigarettes, and newspapers.",,
84886454863,klar,Kommst du mit? / Klar!,of course / naturally,Are you coming with us? / Of course!,,
84886454864,die Klasse,In unserer Klasse sind fünfundzwanzig Schüler.,class,In our class there are twenty five pupils.,,
84886454865,die Klasse,Im Zug fahre ich immer 2. Klasse.,class,On the train I always travel in second class.,,
84886454866,die Kleidung,"Wo finde ich Kleidung? / Jacken im ersten, Jeans im zweiten Stock.",clothes,"Where can I find clothes? / Jackets on the first floor, jeans on the second.",,
84886454867,klein,Eltville ist eine kleine Stadt am Rhein.,small,Eltwille is a small town on the Rhine.,,
84886454868,kochen,Herr Georgi kann gut kochen.,to cook,Mr Georgi is good at cooking.,,
84886454869,"der Koffer, –",Ist das Ihr Koffer?,suitcase,Is that your suitcase?,,
84886454870,"der Kollege, -n",Wie heißt die neue Kollegin?,colleague,What’s the new colleague called?,NB: female,
84886454871,kommen,Woher kommen Sie? / Aus Frankreich.,to come,Where do you come from? / From France.,,
84886454872,kommen,Kommst du mit ins Schwimmbad?,to come,Are you coming with us to the pool?,,
84886454873,können,Ich kann Deutsch und Russisch.,to be able to,I can speak German and Russian.,,
84886454874,können,Können Sie mir helfen?,to be able to,Can you help me?,,
84886454875,das Konto,Das Geld überweisen wir am ersten März auf Ihr Konto.,account,We will transfer the money to your account on the first of March.,,
84886454876,der Kopf,Mein Kopf tut weh!,head,My head hurts!,,
84886454877,kosten,Wie viel kostet das? / 10 Euro.,to cost,How much does that cost? / 10 euros.,,
84886454878,krank,"Ich kann heute nicht zur Arbeit kommen, ich bin krank und liege im Bett.",ill,"I can’t come to work today, I’m ill in bed.",,
84886454879,kriegen,Ich kriege 15 Euro in der Stunde für meine Arbeit.,to get,I get 15 euros an hour for my work.,,
84886454880,die Küche,Der neue Herd kommt in die Küche.,kitchen,The new stove goes in the kitchen.,,
84886454881,der Kuchen,Ich nehme ein Stück Kuchen.,cake,I’ll have a piece of cake.,,
84886454882,der Kugelschreiber,Hast du einen Kugelschreiber für mich?,ball-point pen,Do you have a pen I can borrow?,,
84886454883,der Kühlschrank,"Haben wir noch Milch? / Ja, im Kühlschrank.",fridge,"Do we still have milk? / Yes, in the fridge.",,
84886454884,kulturell interessiert,Ich bin kulturell interessiert. Ich gehe oft ins Museum.,interested in culture,I am interested in culture. I often go to the museum.,,
84886454885,kulturell,Die Geschichte ist kulturell wichtig.,cultural,History is culturally important.,,
84886454886,sich kümmern,Jede Mutter kümmert sich um ihre kleinen Kinder.,to look after,Every mother looks after her little children.,,
84886454887,"der Kunde, -n","Einen Moment, bitte. Ich habe eine Kundin.",customer,"One moment, please. I have a customer.",NB: female,
84886454888,"der Kurs, -e",Der Deutschkurs geht bis zum Sommer.,course,The German course runs until summer.,,
84886454889,kurz,Ricardo hat kurzes Haar.,short,Ricardo has short hair.,,
84886454890,lachen,Die Kinder lachen viel.,to laugh,The children laugh a lot.,,
84886454891,"der Laden, -ä",Im Buchladen können Sie Bücher kaufen.,shop,In the bookshop you can buy books.,,
84886454892,"das Land, -ä, er",Italien ist ein schönes Land.,country,Italy is a beautiful country.,,
84886454893,lang,Die Jeans ist zu lang.,long,The jeans are too long.,,
84886454894,lange,Wie lange fährt der Zug von Hamburg nach Berlin?,long,How long is the train journey from Hamburg to Berlin?,,
84886454895,langsam,Könnten Sie bitte etwas langsamer sprechen?,slow,Can you please speak a little slower?,,
84886454896,laufen,"Ich möchte nicht Auto fahren, ich möchte laufen.",to walk/run,"I don’t want to go by car, I want to walk.",,
84886454897,laut,Nicht so laut! Das Baby schläft.,loud,Not so loud! The baby is sleeping.,,
84886454898,leben,Sie lebt bei ihrer Schwester.,to live,She lives at her sister‘s.,,
84886454899,leben,Ihre Eltern leben nicht mehr.,to live,Her parents are no longer alive.,,
84886454900,das Leben,Das Leben in diesem Land ist teuer.,life,Life in this country is expensive.,,
84886454901,die Lebensmittel (pl.),Lebensmittel bekommen Sie im Supermarkt.,food,You can get food from the supermarket.,,
84886454902,ledig,Sind Sie verheiratet? / Nein. Ledig.,single,Are you married? / No. Single.,"NB: marital status, not relationship status",
84886454903,legen,Legen Sie das Buch auf den Tisch.,to put,Put the book on the table.,,
84886454904,"der Lehrer, –",Unsere Deutschlehrerin heißt Frau Müller.,teacher,Our German teacher is called Ms Müller.,,
84886454905,leicht,Der Koffer ist leicht.,light (weight),The suitcase is light.,,
84886454906,leicht,Deutsch ist nicht leicht.,easy,German is not easy.,,
84886454907,leider,Leider kann ich nicht kommen. Ich muss zum Arzt.,unfortunately,Unfortunately I can’t come. I need to go to the doctor.,,
84886454908,leise,Seid leise. Die anderen schlafen schon.,quiet,Be quiet. The others are already asleep.,,
84886454909,lernen,Wie lange lernen Sie schon Deutsch?,to learn,How long have you been learning German?,,
84886454910,lesen,Ich lese ein Buch von García Márquez.,to read,I’m reading a book by García Márquez.,,
84886454911,letzt-,Morgen ist der letzte Kurstag.,last,Tomorrow is the last day of the course.,,
84886454912,die Leute (pl.),In der Disko sind viele Leute.,people,There are a lot of people at the disco.,,
84886454913,das Licht,Wo macht man hier das Licht an?,light,Where do you switch on the light here?,,
84886454914,lieb-,"Liebe Susanne, lieber Hans,",dear,"Dear Susanne, dear Hans,",,
84886454915,lieben,Ich liebe dich!,to love,I love you!,,
84886454916,lieber,Sie fährt lieber mit der Bahn.,to prefer,She prefers to travel by train.,lieber + verb = to prefer doing something,
84886454917,Lieblings-,Mein Lieblingsfilm ist „Schwarze Augen“.,favourite,My favourite film is “Dark Eyes”.,,
84886454918,"das Lied, -er",Welches ist dein Lieblingslied?,song,Which is your favourite song?,,
84886454919,liegen,Um neun Uhr liegt Judith noch im Bett.,to lie,At 9 am Judith is still (lying) in bed.,,
84886454920,liegen,Frankfurt liegt am Main.,to lie / be located,Frankfurt lies on the Main.,NB: not used for humans,
84886454921,links,Gehen Sie die nächste Straße links.,left,Go down the next street on the left.,,
84886454922,"der Lkw, -s",Dieser Lastkraftwagen ist sehr groß.,HGV,That heavy goods vehicle is very large.,,
84886454923,das Lokal,In unserer Straße gibt es ein neues Lokal.,pub,There is a new pub on our street.,,
84886454924,"die Lösung, -en",Die Lösung ist ganz einfach.,solution,The solution is quite simple.,,
84886454925,lustig,Frau Mertens ist lustig. Sie lacht immer.,funny,Ms Mertens is funny. She is always laughing.,,
84886454926,machen,Was machst du heute Abend?,to do,What are you doing this evening?,,
84886454927,machen,Ich muss jetzt das Essen machen.,to make,I need to make the food now.,,
84886454928,machen,Das macht 5 Euro 95.,to come to,That comes to 5 euros 95.,,
84886454929,machen,Das macht nichts.,…,It doesn't matter.,set phrase,
84886454930,"das Mädchen, –",Familie Kurz bekommt ein Baby. / Junge oder Mädchen?,girl,The Kurz family are expecting a new baby. / Boy or girl?,,
84886454931,man,Hier darf man nicht rauchen.,one / impersonal ‘you’,You may not smoke here.,NB: does not sound pretentious in German,
84886454932,"der Mann, -ä, er",Mein Mann arbeitet bei der Polizei.,man / husband,My husband works for the police.,,
84886454933,männlich,Kreuzen Sie bitte an: „weiblich“ oder „männlich“.,male,Please tick “female” or “male”.,,
84886454934,"die Maschine, -n",Die Waschmaschine ist günstig.,machine,The washing machine is cheap.,,
84886454935,das Meer,Wir machen Urlaub am Meer.,sea,We are holidaying by the sea.,,
84886454936,mehr,Dieses Auto kostet 1.000 Euro mehr als das andere.,more,This car costs 1000 euros more than the other.,,
84886454937,mein,Mein Vater ist Arzt.,my,My father is a doctor.,,
84886454938,meist-,Die meisten Norddeutschen sind sehr groß.,most,Most northern Germans are very tall.,,
84886454939,"der Mensch, -en",Die Menschen sind hier anders als bei uns.,people,The people here are different than at home.,,
84886454940,mieten,Ich möchte ein Auto mieten.,to rent,I would like to rent a car.,,
84886454941,die Miete,Die Miete für diese Wohnung ist 600 Euro.,rent,The rent for this flat is 600 euros.,,
84886454942,die Milch,Die Milch steht im Kühlschrank.,milk,The milk is in the fridge.,,
84886454943,mit,Trinken Sie den Kaffee mit Milch?,with,Do you take milk with your coffee?,,
84886454944,mitbringen,Ich gehe einkaufen. Soll ich dir was mitbringen?,to bring with one / to get (sth. for sb.),I’m going shopping. Should I get you anything?,,
84886454945,mitkommen,Ich gehe ins Kino. Kommst du mit?,to come with,I’m going to the cinema. Are you coming with me?,,
84886454946,mitmachen,Warum macht ihr nicht mit?,to join in,Why don‘t you join in?,NB: addressing a group informally,
84886454947,mitnehmen,Nehmen wir meine Schwester ins Kino mit?,to take with,Are we taking my sister with us to the cinema?,,
84886454948,die Mitte,Der Lehrer steht in der Mitte des Klassenzimmers.,middle,The teacher stands in the middle of the classroom.,,
84886454949,die Möbel (pl.),Sind die Möbel neu?,furniture,Is the furniture new?,,
84886454950,möchten,Was möchten Sie trinken?,would like to,What would you like to drink?,,
84886454951,mögen,Magst du Kaffee oder Tee?,to like,Do you like coffee or tea?,,
84886454952,möglich,Mit dieser Fahrkarte ist die Fahrt ab 9 Uhr möglich.,possible,"With this ticket, it is possible to travel after 9 am.",,
84886454953,der Moment,Moment mal bitte!,moment,"Just a moment, please!",,
84886454954,der Moment,Einen Moment bitte.,moment,"One moment, please.",,
84886454955,morgen,Morgen beginnt die Schule um 10 Uhr.,tomorrow,Tomorrow school begins at 10 am.,,
84886454956,müde,Ich bin müde. Ich gehe schlafen.,tired,I’m tired. I’m going to sleep.,,
84886454957,der Mund,Öffnen Sie den Mund.,mouth,Open your mouth.,,
84886454958,müssen,Ich muss jeden Tag von 8 Uhr bis 18 Uhr arbeiten.,to have to,I have to work from 8 am to 6 pm every day.,,
84886454959,"die Mutter, -ü",Frau Berghäuser ist die Mutter von Michaela.,mother,Ms Berghäuser is the mother of Michaela.,,
84886454960,nach,Ich gehe jetzt nach Hause.,to (somewhere),I’m going home now.,,
